{
  "schema": "skenion.node.definition",
  "schemaVersion": "0.1.0",
  "id": "core.toggle",
  "version": "0.1.0",
  "displayName": "Toggle",
  "category": "Values",
  "ports": [
    {
      "id": "in",
      "direction": "input",
      "label": "In",
      "type": {
        "flow": "value",
        "dataKind": "boolean"
      },
      "required": false,
      "activation": "trigger"
    },
    {
      "id": "set",
      "direction": "input",
      "label": "Set",
      "type": {
        "flow": "value",
        "dataKind": "boolean"
      },
      "required": false,
      "activation": "latched"
    },
    {
      "id": "bang",
      "direction": "input",
      "label": "Bang",
      "type": {
        "flow": "event",
        "dataKind": "event.bang"
      },
      "required": false,
      "activation": "trigger"
    },
    {
      "id": "value",
      "direction": "output",
      "label": "Value",
      "type": {
        "flow": "value",
        "dataKind": "boolean"
      }
    }
  ],
  "execution": {
    "model": "value"
  },
  "state": {
    "persistent": false
  },
  "permissions": [],
  "capabilities": []
}
